{
  "schemaVersion": 1,
  "revision": 1,
  "generatedAt": 1790596800,
  "meter": {
    "bars": [
      {
        "provider": "claude",
        "percent": 34.0,
        "level": "normal",
        "windowId": "session"
      },
      {
        "provider": "codex",
        "percent": null,
        "level": "normal",
        "windowId": null
      }
    ],
    "level": "normal"
  },
  "providers": [
    {
      "id": "claude",
      "name": "Claude Code",
      "state": "stale",
      "message": "Sign-in expired. Open Claude Code to refresh it.",
      "plan": "Max 20x",
      "windows": [
        {
          "id": "session",
          "label": "Session",
          "kind": "session",
          "usedPercent": 34.0,
          "resetsAt": 1790613600,
          "windowMinutes": 300,
          "level": "normal",
          "source": "oauth",
          "observedAt": 1790586000
        },
        {
          "id": "weekly_all",
          "label": "Weekly",
          "kind": "weekly",
          "usedPercent": 15.0,
          "resetsAt": 1790989200,
          "windowMinutes": 10080,
          "level": "normal",
          "source": "oauth",
          "observedAt": 1790586000
        },
        {
          "id": "weekly_scoped:fable",
          "label": "Weekly \u00b7 Fable",
          "kind": "model",
          "usedPercent": 0.0,
          "resetsAt": 1790989200,
          "windowMinutes": 10080,
          "level": "normal",
          "source": "oauth",
          "observedAt": 1790586000
        }
      ],
      "credits": {
        "label": "Extra usage",
        "enabled": false,
        "used": 0.0,
        "limit": null,
        "currency": "USD",
        "percent": null,
        "detail": "Turned off"
      },
      "breakdown": [
        {
          "key": "claude_code",
          "label": "Claude Code",
          "percent": 97.0
        },
        {
          "key": "chat",
          "label": "Chats",
          "percent": 0.0
        },
        {
          "key": "cowork",
          "label": "Cowork",
          "percent": 3.0
        },
        {
          "key": "other",
          "label": "Other",
          "percent": 0.0
        }
      ],
      "tokens": {
        "today": {
          "input": 182340,
          "output": 96120,
          "cacheRead": 41220000,
          "cacheWrite": 1804000,
          "reasoning": 0,
          "total": 43302460,
          "costUsd": 31.42,
          "unpricedTokens": 0,
          "requests": 412
        },
        "last7Days": {
          "input": 1402110,
          "output": 688900,
          "cacheRead": 302110000,
          "cacheWrite": 12980000,
          "reasoning": 0,
          "total": 317181010,
          "costUsd": 228.17,
          "unpricedTokens": 0,
          "requests": 3120
        },
        "byModel": [
          {
            "model": "claude-opus-5-5",
            "input": 1101000,
            "output": 590000,
            "cacheRead": 260000000,
            "cacheWrite": 11000000,
            "reasoning": 0,
            "total": 272691000,
            "costUsd": 201.33,
            "unpricedTokens": 0,
            "requests": 2410
          },
          {
            "model": "claude-sonnet-5",
            "input": 290000,
            "output": 95000,
            "cacheRead": 41000000,
            "cacheWrite": 1900000,
            "reasoning": 0,
            "total": 43285000,
            "costUsd": 24.51,
            "unpricedTokens": 0,
            "requests": 650
          },
          {
            "model": "claude-haiku-4-5-20251001",
            "input": 11110,
            "output": 3900,
            "cacheRead": 1110000,
            "cacheWrite": 80000,
            "reasoning": 0,
            "total": 1205010,
            "costUsd": 2.33,
            "unpricedTokens": 0,
            "requests": 60
          }
        ],
        "updatedAt": 1790596770
      },
      "accountTokens": null,
      "updatedAt": 1790586000
    },
    {
      "id": "codex",
      "name": "Codex",
      "state": "unauthenticated",
      "message": "Codex is not signed in. Run `codex login`.",
      "plan": null,
      "windows": [],
      "credits": null,
      "breakdown": [],
      "tokens": {
        "today": {
          "input": 52000,
          "output": 18400,
          "cacheRead": 610000,
          "cacheWrite": 0,
          "reasoning": 9200,
          "total": 680400,
          "costUsd": 0.99,
          "unpricedTokens": 0,
          "requests": 38
        },
        "last7Days": {
          "input": 410000,
          "output": 121000,
          "cacheRead": 4900000,
          "cacheWrite": 0,
          "reasoning": 61000,
          "total": 5431000,
          "costUsd": 7.42,
          "unpricedTokens": 0,
          "requests": 301
        },
        "byModel": [
          {
            "model": "gpt-5.3-codex",
            "input": 410000,
            "output": 121000,
            "cacheRead": 4900000,
            "cacheWrite": 0,
            "reasoning": 61000,
            "total": 5431000,
            "costUsd": 7.42,
            "unpricedTokens": 0,
            "requests": 301
          }
        ],
        "updatedAt": 1790596770
      },
      "accountTokens": null,
      "updatedAt": 1790596740
    }
  ]
}